{
  "object_id": "aos:debts:DebtTransition:renew-ci-debt",
  "object_kind": "DebtTransition",
  "debt_id": "DEP-CB12-R4E-001",
  "from_status": "OPEN",
  "to_status": "RENEWED",
  "evidence_refs": ["docs/governance/evidence/aos-fix-1/registry-check-output.txt"],
  "reason": "Debt remains OPEN; AOS-Core pipeline now functional. Renewing due_stage to AOS-PROMOTE-2.",
  "severity": "low",
  "review_required": true,
  "not_claimed": [
    "Debt transition is not debt resolution",
    "Renewal does not close the debt",
    "This is a dogfood submission"
  ]
}
